{
  "candidate_id": "CV001",
  "candidate_name": "Nguyễn Văn A",
  "full_time": true,
  "months_sales": 18,
  "months_b2b": 18,
  "prospecting_channels": ["phone", "email", "linkedin"],
  "communication_evidence": "Tư vấn giải pháp SaaS và đàm phán với chủ doanh nghiệp",
  "crm_tools": ["HubSpot"],
  "quantified_achievement": "Đạt 112% KPI; trung bình 24 cuộc hẹn/tháng",
  "market_experience": ["SaaS"],
  "office_tools": ["Excel", "Google Sheets"],
  "evidence_summary": "- 18 tháng làm Sales Executive, tiếp cận khách hàng SME.\n- Tìm khách qua điện thoại, email và LinkedIn.\n- Quản lý pipeline bằng HubSpot.\n- Đạt 112% KPI và trung bình 24 cuộc hẹn/tháng.",
  "evidence": {
    "months_sales": "Sales Executive — 01/2025–06/2026",
    "months_b2b": "Tìm kiếm khách hàng SME",
    "prospecting_channels": "điện thoại, email và LinkedIn",
    "communication_evidence": "Tư vấn giải pháp SaaS và đàm phán",
    "crm_tools": "Quản lý pipeline trên HubSpot",
    "quantified_achievement": "Đạt 112% KPI; 24 cuộc hẹn/tháng"
  }
}
